{
  "protocol": "glitchscout/1",
  "message_type": "QUERY_REPLY",
  "id": "00000026-0000-4000-8000-000000000026",
  "reply_to": "0000001e-0000-4000-8000-00000000001e",
  "session": "s-1",
  "tick_frame": 100,
  "ts": 1761264000.25,
  "payload": {
    "kind": "line_of_sight",
    "result": {
      "visible": false,
      "blocker_id": "crate_2"
    }
  }
}
