{
  "protocol": "glitchscout/1",
  "message_type": "ACTION_INJECT",
  "id": "0000000f-0000-4000-8000-00000000000f",
  "reply_to": null,
  "session": "s-1",
  "tick_frame": null,
  "ts": 1761264000.25,
  "payload": {
    "digital_buttons": [
      {
        "action": "jump",
        "op": "press",
        "hold_ticks": 12
      }
    ],
    "analog_axes": [
      {
        "action": "move",
        "x": 0.0,
        "y": 1.0
      }
    ]
  }
}
