{
  "protocol": "glitchscout/1",
  "message_type": "STATE_UPDATE",
  "id": "0000000a-0000-4000-8000-00000000000a",
  "reply_to": null,
  "session": "s-1",
  "tick_frame": 14053,
  "ts": 1761264000.25,
  "payload": {
    "mode": "delta",
    "player": {
      "position": {
        "x": 10.5,
        "y": 0,
        "z": -4.2
      },
      "velocity": {
        "x": 0,
        "y": 0,
        "z": 0
      },
      "health": 100,
      "state_flags": [
        "is_grounded"
      ]
    },
    "removed": {
      "interactables": [
        "keycard_red"
      ]
    }
  }
}
