{
  "protocol": "glitchscout/1",
  "message_type": "ACTION_INJECT",
  "id": "00000010-0000-4000-8000-000000000010",
  "reply_to": null,
  "session": "s-1",
  "tick_frame": null,
  "ts": 1761264000.25,
  "payload": {
    "digital_buttons": [
      {
        "action": "interact",
        "op": "release"
      }
    ]
  }
}
