{
  "protocol": "glitchscout/1",
  "message_type": "STATE_UPDATE",
  "id": "0000000b-0000-4000-8000-00000000000b",
  "reply_to": null,
  "session": "s-1",
  "tick_frame": 14060,
  "ts": 1761264000.25,
  "payload": {
    "player": {
      "position": {
        "x": 10.5,
        "y": 0,
        "z": -4.2
      },
      "velocity": {
        "x": 0,
        "y": 0,
        "z": 0
      },
      "health": 100,
      "state_flags": [
        "is_grounded"
      ]
    },
    "interactables": [
      {
        "id": "door_3",
        "type": "door",
        "position": {
          "x": 12,
          "y": 0,
          "z": -1.5
        },
        "distance": 1.6,
        "state": "closed",
        "enabled": true,
        "required_action": "interact",
        "interaction_range": 2.0,
        "requires": [
          "keycard_red"
        ]
      }
    ],
    "camera": {
      "position": {
        "x": 8,
        "y": 3,
        "z": -8
      },
      "yaw": 42.0,
      "pitch": -15.0,
      "mode": "third_person"
    },
    "threats": [
      {
        "id": "red_robot_2",
        "type": "enemy",
        "position": {
          "x": 20,
          "y": 0,
          "z": -3
        },
        "distance": 9.1,
        "health": 40,
        "attack_range": 6.0,
        "state": "aiming"
      }
    ],
    "ui_elements": [
      {
        "id": "main_menu/play",
        "type": "button",
        "text": "Play",
        "enabled": true,
        "visible": true,
        "focused": true,
        "rect": [
          540,
          300,
          200,
          48
        ]
      }
    ],
    "truncated": false,
    "mode": "full"
  }
}
