{
  "protocol": "glitchscout/1",
  "message_type": "QUERY",
  "id": "00000018-0000-4000-8000-000000000018",
  "reply_to": null,
  "session": "s-1",
  "tick_frame": null,
  "ts": 1761264000.25,
  "payload": {
    "kind": "nav_path",
    "params": {
      "from": {
        "x": 0,
        "y": 0,
        "z": 0
      },
      "to": {
        "x": 12,
        "y": 0,
        "z": -1.5
      }
    }
  }
}
