{
  "protocol": "glitchscout/1",
  "message_type": "QUERY",
  "id": "0000001a-0000-4000-8000-00000000001a",
  "reply_to": null,
  "session": "s-1",
  "tick_frame": null,
  "ts": 1761264000.25,
  "payload": {
    "kind": "raycast",
    "params": {
      "origin": {
        "x": 0,
        "y": 1,
        "z": 0
      },
      "direction": {
        "x": 1,
        "y": 0,
        "z": 0
      },
      "max_distance": 50
    }
  }
}
