{
  "protocol": "glitchscout/1",
  "message_type": "QUERY_REPLY",
  "id": "00000023-0000-4000-8000-000000000023",
  "reply_to": "00000019-0000-4000-8000-000000000019",
  "session": "s-1",
  "tick_frame": 100,
  "ts": 1761264000.25,
  "payload": {
    "kind": "nav_sample",
    "result": {
      "points": [
        {
          "position": {
            "x": -10,
            "y": 0,
            "z": -10
          },
          "reachable": true
        },
        {
          "position": {
            "x": -8,
            "y": 0,
            "z": -10
          },
          "reachable": false
        }
      ]
    }
  }
}
