{
  "protocol": "glitchscout/1",
  "message_type": "EVENT",
  "id": "0000000c-0000-4000-8000-00000000000c",
  "reply_to": null,
  "session": "s-1",
  "tick_frame": 100,
  "ts": 1761264000.25,
  "payload": {
    "kind": "game",
    "name": "player_died",
    "data": {
      "cause": "fall"
    }
  }
}
