{
  "protocol": "glitchscout/1",
  "message_type": "COMMAND",
  "id": "00000014-0000-4000-8000-000000000014",
  "reply_to": null,
  "session": "s-1",
  "tick_frame": null,
  "ts": 1761264000.25,
  "payload": {
    "name": "teleport",
    "args": {
      "position": {
        "x": 1,
        "y": 0,
        "z": 2
      }
    }
  }
}
