{
  "protocol": "glitchscout/1",
  "message_type": "QUERY_REPLY",
  "id": "00000024-0000-4000-8000-000000000024",
  "reply_to": "0000001c-0000-4000-8000-00000000001c",
  "session": "s-1",
  "tick_frame": 100,
  "ts": 1761264000.25,
  "payload": {
    "kind": "is_on_screen",
    "result": {
      "on_screen": true,
      "screen_position": [
        640,
        360
      ]
    }
  }
}
