{
  "protocol": "glitchscout/1",
  "message_type": "QUERY",
  "id": "0000001d-0000-4000-8000-00000000001d",
  "reply_to": null,
  "session": "s-1",
  "tick_frame": null,
  "ts": 1761264000.25,
  "payload": {
    "kind": "next_waypoint",
    "params": {
      "from": {
        "x": 0,
        "y": 0,
        "z": 0
      },
      "to": {
        "x": 5,
        "y": 0,
        "z": 5
      }
    }
  }
}
