{
  "protocol": "glitchscout/1",
  "message_type": "OBSERVATION",
  "id": "00000009-0000-4000-8000-000000000009",
  "reply_to": "00000004-0000-4000-8000-000000000004",
  "session": "s-1",
  "tick_frame": 100,
  "ts": 1761264000.25,
  "payload": {
    "player": {
      "position": {
        "x": 10.5,
        "y": 0,
        "z": -4.2
      },
      "velocity": {
        "x": 0,
        "y": 0,
        "z": 0
      },
      "health": 100,
      "state_flags": [
        "is_grounded"
      ]
    },
    "interactables": [
      {
        "id": "door_3",
        "type": "door",
        "position": {
          "x": 12,
          "y": 0,
          "z": -1.5
        },
        "distance": 1.6,
        "state": "closed",
        "enabled": true,
        "required_action": "interact",
        "interaction_range": 2.0,
        "requires": [
          "keycard_red"
        ]
      }
    ],
    "truncated": true
  }
}
