{
  "protocol": "glitchscout/1",
  "message_type": "QUERY",
  "id": "0000001b-0000-4000-8000-00000000001b",
  "reply_to": null,
  "session": "s-1",
  "tick_frame": null,
  "ts": 1761264000.25,
  "payload": {
    "kind": "find_entities",
    "params": {
      "types": [
        "lever"
      ],
      "max_n": 5
    }
  }
}
